{
  "contract_version": "1.4",
  "completed": [
    {
      "phase": "N0",
      "file": "phase_n0_environment_scaffold.yaml",
      "data_gate": "G0_THREE_SYNTHETIC_FIXTURES",
      "baseline_commit": "72a81f5984838b74304d23263ac450ea4b5a3a9a",
      "approved_at_utc": "2026-07-14"
    },
    {
      "phase": "N1",
      "file": "phase_n1_ingest_state_machine.yaml",
      "data_gate": "G0_THREE_SYNTHETIC_FIXTURES",
      "baseline_commit": "ca812cb71c4a09d273f64d9a6f2747ac3facf4cc",
      "completion_approval": "approvals/phase_completion_N1.yaml",
      "approved_at_utc": "2026-07-14"
    }
    ,{
      "phase": "N2A",
      "file": "phase_n2a_pose_and_segmentation_benchmark.yaml",
      "baseline_commit": "f79d2df504622ff82aa5e53d1486310bbea9985a",
      "completion_approval": "approvals/phase_completion_N2A.yaml",
      "approved_at_utc": "2026-07-22"
    },
    {
      "phase": "N2B0",
      "file": "phase_n2b0_model_artifact_qualification.yaml",
      "baseline_commit": "f331621c84905aef921c612908d01d3a8a2f577a",
      "completion_approval": "approvals/phase_completion_N2B0.yaml",
      "approved_at_utc": "2026-07-24"
    },
    {
      "phase": "N2B0_5",
      "file": "phase_n2b0_5_artifact_rights_and_provenance.yaml",
      "baseline_commit": "5ad9f8d7d0d6fa267df02d90ef25957bc679e232",
      "completion_approval": "approvals/phase_completion_N2B0_5.yaml",
      "approved_at_utc": "2026-07-26"
    },
    {
      "phase": "N2B0_6",
      "file": "phase_n2b0_6_license_clear_alternative_candidate_research.yaml",
      "baseline_commit": "eb2eaeb61f1c21923d131a115d63edbcdebd8cb2",
      "completion_approval": "approvals/phase_completion_N2B0_6.yaml",
      "approved_at_utc": "2026-07-29"
    },
    {
      "phase": "N2B0_7",
      "file": "phase_n2b0_7_gpu_native_qualification.yaml",
      "baseline_commit": "f2b1c38301d71da52b855f73de8a67908cb525ef",
      "completion_approval": "approvals/phase_completion_N2B0_7.yaml",
      "approved_at_utc": "2026-07-29"
    }
  ],
  "authorized": [
    {
      "kind": "DATA_GATE",
      "phase": "N1",
      "file": "gate_g1_calibration_20.yaml",
      "data_gate": "G1_CALIBRATION_20",
      "max_assets": 20,
      "approval_record": "approvals/data_gate_approval_G1.yaml"
    },
    {
      "kind": "ENGINEERING_PHASE",
      "phase": "N2A",
      "file": "phase_n2a_pose_and_segmentation_benchmark.yaml",
      "capability": "N2A_POSE_SEGMENTATION_BENCHMARK_PREPARATION",
      "approval_record": "approvals/phase_completion_G1.yaml"
    },
    {
      "kind": "ENGINEERING_PHASE",
      "phase": "N2B1R",
      "file": "phase_n2b1r_local_research_model_acquisition.yaml",
      "capability": "N2B1R_LOCAL_RESEARCH_MODEL_ACQUISITION",
      "approval_record": "approvals/owner_local_research_execution_N2B1R_to_N5R.yaml"
    },
    {
      "kind": "ENGINEERING_PHASE",
      "phase": "N2B1P",
      "file": "phase_n2b1p_local_research_cache_promotion.yaml",
      "capability": "N2B1P_LOCAL_RESEARCH_CACHE_PROMOTION",
      "approval_record": "approvals/owner_n2b1p_cache_promotion.yaml"
    }
  ],
  "review_candidates": [
    {
      "kind": "BOUNDED_RUNTIME_REVIEW_CANDIDATE",
      "phase": "N2B2_RUNTIME_GPU_VALIDATION",
      "file": "phase_n2b2_runtime_gpu_validation_and_s20_preparation.yaml",
      "capability": "N2B2_RUNTIME_GPU_VALIDATION_AND_SYNTHETIC_S20_PREPARATION",
      "approval_record": "approvals/owner_n2b2_runtime_gpu_validation_receipt.yaml",
      "project_state": "N2B2_LOCKED",
      "execution_status": "SYNTHETIC_GPU_ONLY"
    },
    {
      "kind": "BOUNDED_S20_REVIEW_CANDIDATE",
      "phase": "N2B2_S20_SYNTHETIC_VALIDATION",
      "file": "phase_n2b2_s20_synthetic_validation.yaml",
      "capability": "N2B2_S20_SYNTHETIC_VALIDATION",
      "approval_record": "approvals/owner_n2b2_s20_synthetic_validation_receipt.yaml",
      "project_state": "N2B2_LOCKED",
      "execution_status": "CONDITIONAL_SYNTHETIC_ONLY"
    },
    {
      "kind": "BOUNDED_QWEN_FACT_BINDING_REVIEW_CANDIDATE",
      "phase": "N2B2_QWEN_FACT_BINDING_CONTRACT_REMEDIATION",
      "file": "phase_n2b2_qwen_fact_binding_remediation.yaml",
      "capability": "N2B2_QWEN_FACT_BINDING_CONTRACT_REMEDIATION_AND_S20_V3_RESUME",
      "approval_record": "approvals/owner_n2b2_qwen_fact_binding_remediation_receipt.yaml",
      "project_state": "N2B2_LOCKED",
      "execution_status": "SYNTHETIC_QWEN_CONTRACT_ONLY"
    },
    {
      "kind": "BOUNDED_S20_ARTIFACT_INTEGRITY_REVIEW_CANDIDATE",
      "phase": "N2B2_S20_ARTIFACT_INTEGRITY_REMEDIATION",
      "file": "phase_n2b2_s20_artifact_integrity_remediation.yaml",
      "capability": "N2B2_S20_ARTIFACT_INTEGRITY_REMEDIATION_AND_EXTERNAL_REVIEW",
      "approval_record": "approvals/owner_n2b2_s20_artifact_integrity_remediation_receipt.yaml",
      "project_state": "N2B2_LOCKED",
      "execution_status": "SYNTHETIC_ARTIFACT_INTEGRITY_ONLY"
    },
    {
      "kind": "BOUNDED_OLLAMA_RUNTIME_IDENTITY_REVALIDATION",
      "phase": "N2B2_OLLAMA_RUNTIME_IDENTITY_REVALIDATION",
      "file": "phase_n2b2_ollama_runtime_identity_revalidation_20260906.yaml",
      "capability": "N2B2_OLLAMA_RUNTIME_IDENTITY_REVALIDATION_20260906",
      "approval_record": "approvals/owner_n2b2_ollama_runtime_identity_revalidation_20260906.yaml",
      "project_state": "N2B2_LOCKED",
      "execution_status": "SYNTHETIC_OLLAMA_0_33_3_REVALIDATION_ONLY"
    },
    {
      "kind": "BOUNDED_B_SOURCE_NETWORK_REACQUISITION_REVIEW_CANDIDATE",
      "phase": "N2B1P",
      "file": "phase_n2b1p_b_source_network_reacquisition_v1.yaml",
      "capability": "N2B1P_B_SOURCE_NETWORK_REACQUISITION_V1",
      "approval_record": "approvals/owner_n2b1p_b_source_network_reacquisition_v1.yaml",
      "project_state": "LOCKED",
      "candidate_status": "REVIEW_CANDIDATE",
      "contract_status": "OWNER_AUTHORIZED_AWAITING_EXTERNAL_REVIEW",
      "execution_status": "NOT_RUN",
      "network_access": "DENY"
    }
  ],
  "locked": [
    {"phase": "N2B1", "file": "phase_n2_pose_and_segmentation.yaml", "capability": "N2B1_MODEL_DOWNLOAD"},
    {"phase": "N2B1_Q", "file": "phase_n2_pose_and_segmentation.yaml", "capability": "N2B1_Q_QUARANTINE_DOWNLOAD"},
    {"phase": "N2B1_P", "file": "phase_n2_pose_and_segmentation.yaml", "capability": "N2B1_P_CACHE_PROMOTION"},
    {"phase": "N2B2", "file": "phase_n2_pose_and_segmentation.yaml", "capability": "N2B2_REAL_BENCHMARK"},
    {"phase": "N2B2", "file": "phase_n2b2_synthetic_model_stack_validation.yaml", "capability": "N2B2_SYNTHETIC_MODEL_STACK_VALIDATION", "contract_status": "AUTHORIZED_CONTROL_PLANE_ONLY", "blocked_stop": "N2B2_EXECUTION_BLOCKED_N2B1P_NOT_APPROVED"},
    {"phase": "N3", "file": "phase_n3_facts_and_interpretation.yaml"},
    {"phase": "N4", "file": "phase_n4_director_prompts.yaml"},
    {"phase": "N5", "file": "phase_n5_review_and_export.yaml"},
    {"phase": "N6", "file": "phase_n6_pilot_and_search.yaml"},
    {"phase": "N7", "file": "phase_n7_app_bundle_integration.yaml"},
    {"phase": "N8", "file": "phase_n8_nightly_scheduler_openclaw.yaml"}
  ],
  "rule": "N0, N1, G1, N2A, N2B0, N2B0.5, N2B0.6, and N2B0.7 are immutable approved baselines. N2B1R acquisition is complete. N2B1P remains the governed cache-promotion baseline. The N2B2 runtime entry is only a bounded synthetic GPU review candidate; PROJECT_STATE and the production N2B2 lock remain unchanged."
}
